{
  "$schema": "../schemas/artifact-set.schema.json",
  "schemaVersion": 2,
  "generator": "scripts/architecture_artifacts.py",
  "sourceRevision": "866d8dfab0ebcf56887aa451162f2d4a51a445ff",
  "revisionSemantics": "provenance-only; normalized content and hashes determine freshness",
  "artifacts": [
    {
      "path": "architecture/inventory.generated.json",
      "format": "json",
      "schema": "architecture/schemas/inventory.schema.json",
      "sha256": "ba28e693266bb62eeba9a8c4b1c74b1143ab3269692031d7a32a8ff692a98911"
    },
    {
      "path": "architecture/generated/code-topology.json",
      "format": "json",
      "schema": "architecture/schemas/topology.schema.json",
      "sha256": "2684bc5ef9b8a47dddae155b00b4fd13138cda13be136e5565a4de3f299337c7"
    },
    {
      "path": "architecture/generated/architecture-conformance.json",
      "format": "json",
      "schema": "architecture/schemas/architecture-conformance.schema.json",
      "sha256": "9322dea1e55d3bf431d0cf21871a388978b6eeae2d2c722ab1be7bb629e204cd"
    },
    {
      "path": "architecture/generated/current-projects.dot",
      "format": "dot",
      "sha256": "809a05a31dbeb4c725b8a8bca59654e322c9e7115d03dfe74dfb430c48907223"
    },
    {
      "path": "architecture/generated/target-components.dot",
      "format": "dot",
      "sha256": "b4e78445e77ced6a3ab63ec30f6ea287665207c4a354eda4c18f55c55e2b9b14"
    },
    {
      "path": "architecture/generated/current-component-types.dot",
      "format": "dot",
      "sha256": "a0f7e3d2647f9ad6328f30e46dad8f9ee086fbd3a9dfc0e865d15a5d0276ff61"
    },
    {
      "path": "architecture/generated/current-vs-target.dot",
      "format": "dot",
      "sha256": "bafd10dcdcb51eb521fa0f5dc9218bba18b10840f7bbf3a49bdab2fee4941f71"
    }
  ],
  "historyArtifacts": [
    {
      "path": "architecture/generated/change-coupling.json",
      "format": "json",
      "schema": "architecture/schemas/change-coupling.schema.json",
      "verification": "schema-and-scope; derived from git history, deliberately not hash-pinned"
    }
  ]
}
